cluster_id,cluster_keywords,case_count
0,"speech, anthropic, claude, injunction, ab, publishers, pure sports, pure, ecf, ai, commercial speech, datasets, amendment, sports, preliminary injunction, preliminary, government, 2d, works, books",7
1,"defendants, openai, complaint, plaintiffs, 3d, works, claim, cir, claims, quizlet, zhao, barkley, code, dismiss, 2025, 2d, fac, work, dkt, compl",32
2,"mark, ravine, trademark, ai, decl, marks, fac, open, 3d, defendants, perplexity, open ai, uspto, evidence, 9th, 9th cir, use, services, confusion, survey",8
3,"llp, plaintiffs, ca, francisco ca, san francisco, francisco, san, llp san, openai, saveri, joseph, lead, hac vice, pro hac, hac, vice, schiller, lead attorney, susman godfrey, godfrey",18
4,"mr, flycatcher, amazon, royalty, feldman, dr, kelly, plaintiff counsel, ecf, doc, arbitration, patents, real, opinions, intent, patent, 2025, 3d, citation, counsel",8
